questType,questId,title,description,targetId,amount,clearNpcID,dialogueList,clearDialogue,refusalDialogue,rewardItemId,rewardAmount
Slay,101,"잿빛 숲의 늑대들","요새 주변의 늑대들이 너무 많아져서 상인들이 오가기 힘들어하네. 좀 처리해주게.",ENEMY_004,5,NPC_001_Guard,"요즘 늑대들 때문에 골치가 아파...;자네가 좀 도와주겠나?","덕분에 길이 안전해졌군. 고맙네. 여기 약소한 보상일세.","...쯧, 용기가 없는 자로군.",MATERIAL_003,50
Collect,201,"엘라라의 연구 재료","새로운 포션을 연구하고 있는데, 하수도 슬라임의 핵이 필요해요. 좀 구해다 줄 수 있나요?",MATERIAL_041,3,COMPANION_003,"실험이 막바지예요!;핵심 재료만 있으면 되는데...!","와! 정말 고마워요! 이걸로 엄청난 걸 만들 수 있을 거예요!","아... 바쁘시군요. 알겠습니다.",MATERIAL_014,5
Deliver,301,"비밀 서신 전달","이 편지를 포르투나 항구의 가렛에게 몰래 전해주게. 절대 다른 사람이 봐선 안 되네.",COMPANION_004,1,COMPANION_004,"자네, 믿을만한 사람 같군...;이 중대한 임무를 맡아주겠나?","흠, 역시 자네로군. 수고했어. 이건 내 성의 표시야.","이 일의 중요성을 모르는군. 다른 사람을 찾아보지.",MATERIAL_019,1
Slay,102,"성지 정화","타락한 순례자들이 성지를 더럽히고 있습니다. 그들을 처단하여 안식을 되찾아주십시오.",ENEMY_012,3,COMPANION_002,"더 이상 성지가 더럽혀지는 것을 볼 수 없습니다.;부디 당신의 힘을 빌려주세요.","성지에 평화가... 감사합니다. 태양신께서 당신을 축복하실 겁니다.","외면하시는군요... 알겠습니다.",MATERIAL_010,10
Collect,202,"튼튼한 방어구 재료","최고의 갑옷을 만들고 싶은데, 재료가 영 마땅치 않군. 혹시 드워프제 강철 도끼를 구해다 줄 수 있겠나?",WEAPON_013,1,NPC_002_Blacksmith,"최고의 갑옷을 만들고 싶은데, 재료가 영 마땅치 않군.;혹시 드워프제 강철 도끼를 구해다 줄 수 있겠나?","오오, 이거라면 되겠어! 고맙네! 이건 답례일세.","하긴, 쉬운 부탁은 아니었지.",MATERIAL_024,3